{"person_id":1375,"full_name":{"name":"Сергий","surname":"Аманов"},"source":{"publication":"«Жития новомучеников и исповедников Российских ХХ века \nМосковской епархии. Дополнительный том 2» \nТверь, 2005 год, стр. 208-213.","author":"Игумен Дамаскин (Орловский)"},"relig_status":"Священномученик","occupation":"священник","birth_place":"Касимов","birth_date":{"day":10,"month":12,"year":null},"death_date":{"day":null,"month":null,"year":2005},"original_text":"\n\n\nСвященномученик Сергий (Аманов) священник\nНоября 27 (10 декабря)\n \nСвященномученик\nСергий (Аманов)\n \nСвященномученик Сергий родился 1 апреля 1873 года в городе Касимове Рязанской губернии в семье псаломщика Ивана Аманова. Отец Сергия умер в 1916 году. В 1894 году Сергей Иванович окончил Рязанскую Духовную семинарию, женился и в 1897 году был рукоположен в сан священника ко храму в селе Колесня Михайловского уезда Рязанской губернии. Село было очень бедное и по тем временам небольшое, всего около двухсот домов. Здесь у отца Сергия и его супруги Марии Яковлевны родилось одиннадцать детей, трое из них умерли в младенчестве. С началом гонений на Русскую Православную Церковь большевики сделали попытку в 1918 году убить священника и пришли к нему в дом. Спасло его тогда от смерти лишь то, что он уехал в другое село, где надо было отпеть почившего священника.\nВ 1929 году в связи с коллективизацией от жителей села Колесня потребовали сдачи зерна в таком количестве, в каком крестьяне никогда раньше не собирали, причем от отца Сергия потребовали зерна больше всех. Крестьяне, посовещавшись, решили, что могут сдать только половину этой нормы. «При проведении кампании по хлебозаготовкам» местные власти, как они о том сами писали впоследствии, «столкнулись с фактом несдачи крестьянами хлеба более 50% нормы». Это обстоятельство, особенно в связи с осложнениями, при которых проходило утверждение плана хлебозаготовок на пленуме сельсовета и общем собрании граждан, навело их на мысль, что есть какая-то сила, противодействующая ходу хлебозаготовок.\n24 сентября 1929 года следователь допросил священника, предъявив ему обвинение в противодействии хлебозаготовкам и в антисоветской деятельности. Выслушав обвинения, отец Сергий сказал: «Виновным себя не признаю. По делу могу лишь показать: в церкви я действительно обратился к верующим и просил мне помочь материально деньгами. О непосильности наложенных на меня налогов я не говорил, а говорил лишь только о том, что мне трудно выплатить все платежи, так как вы сами, некоторые верующие, мне ничего не платите, тогда как с меня учитывают в полной мере, за весь приход. О заготовках хлеба – в церкви не было сказано ни слова. На Пасху я действительно приветствовал христиан и говорил, что мы должны хранить в себе веру, но о власти не было произнесено ни одного слова. Я совершенно лояльно отношусь к советской власти, и когда утверждали устав нашего религиозного общества, я произнес речь, в которой указал на то, что в нашем обществе ни в коем случае не должно быть противников власти, и всегда я старался государственные повинности выполнить первый. К толпе я никогда не обращался, а обращался, если было нужно, прямо к центральной власти. Я считаю наложенную на меня норму хлеба неправильной и непосильной, так как у меня не было такого урожая. От секретаря сельсовета я узнал, что на меня наложено сто семьдесят пять пудов ржи, он указал, что сегодня вечером будет пленум сельсовета, на котором я могу подать свое заявление, так как сам он от меня его не принял. Когда я пришел к сельсовету, выяснилось, что пленума не было».\n23 октября 1929 года власти арестовали отца Сергия и шестерых крестьян. В тот же день священник подал следователю заявление, в котором писал: «Начальник милиции при Захаровском ВИКе при мне доложил начальнику милиции Рязанского округа, что я будто бы отказывался платить хлеб и агитировал граждан не платить хлеб. Не знаю, откуда начальник милиции почерпнул сведения, но эта кляуза не соответствует действительности.\nПрошу допросить всех членов сельсовета и председателя комитета взаимопомощи, что я еще 5 сентября подал письменное заявление, где обещался сдать немедленно излишки хлеба, но просил приставить контроль при обмолоте моей ржи и очистке зерна за мой счет. И после неоднократно просил сельсовет о том же. Это исполнимо. Требовалось только распоряжение, а каждый член сельсовета рад бы был при других условиях заработать при безработице. Но было не выгодно контролировать меня, так как членам сельсовета пришлось бы последовать моему примеру – выяснить добросовестно у себя и у других граждан наличие излишков хлеба, устроить соревнование в сдаче хлеба. А у них у первых были излишки хлеба... Они не удовлетворили моего ходатайства, а я еще в сентябре сдал бы рожь. Говорят, что у нас много дворов, тогда бы пришлось и у них контролировать. Но это неверно фактически. Никто не заявлял желания контроля у себя, и забегать вперед, говорить о них не было основания. А если бы нашлись таковые граждане, то это следовало бы приветствовать и даже устроить бы соревнование. Ни труда, ни расхода для сельсовета, а для государства была бы польза. Не потребовалось бы ходить по амбарам, рыться в сундуках, арестовывать и увеличивать делопроизводство в судах. Я уверен, что, глядя на членов сельсовета, и граждане не очень бы беспокоили своими просьбами сельсовет.\n5 октября председатель сельсовета указала мне машину, и я 6 октября обмолотил. Одна копна не обмолочена по случаю полома машины, после она ручным способом обмолочена. Ждал очереди получить веялку. Не дождавшись, перевеял поломанной веялкой и сдал государству.\nИтак, я стремился сдать, что имел. Но от покупки ржи для сдачи я отказался. Кляуза обо мне исходит от тех, которые устроили ширмы из меня для прикрытия своих фактических излишков».\n22 ноября следствие было закончено. Отца Сергия обвинили в том, что будто бы он, «используя религиозные предрассудки крестьян, в особенности женщин, в целях ослабления мощности советской власти произносил в церкви проповеди, указывая в них на невыполнимость хлебозаготовок, а также на то, что советская власть одурачивает крестьян, соблазняет их и тому подобное».\n29 января 1930 года Особое Совещание при Коллегии ОГПУ приговорило отца Сергия к трем годам заключения в концлагерь. Наказание он отбывал в Пенюжском, Архангельском и Вишерском лагерях. В феврале 1932 года отец Сергий вернулся домой, и ему пришлось устроиться счетоводом в совхозе. Через полгода он был уволен по сокращению штатов. Полгода он был без работы, а затем был назначен настоятелем Пятницкой церкви в селе Мягкое Серебрянопрудского района.\n22 ноября 1937 года отец Сергий был арестован, заключен в тюрьму при районном отделении НКВД в Тульской области и через несколько дней допрошен.\n– Допрошенные нами свидетели Крюков, Пименов и другие показали, что в разговорах с ними вы проводили антисоветскую агитацию, – и следователь зачитал показания свидетелей. – Следствие требует от вас признания своей вины.\n– Никаких антисоветских разговоров я во время крестин никогда ни с кем не вел. Я считаю, что показания свидетелей по этому вопросу являются ложными, ни на чем не основанными. Я хорошо помню, что в деревне Есипово я причащал одну молодую девушку – фамилии ее я сейчас не помню, – которую через несколько дней я хоронил. Но никаких антисоветских разговоров я в это время не вел. Правда, перед выносом тела этой девушки для похорон я при большом стечении народа сказал, что умершая умела работать и умела молиться, она пожелала, чтобы я ее причастил и она вкусила Святых Таин. Больше я ничего не говорил.\n– Почему вы так упорно отрицаете свою вину в антисоветской агитации? По показаниям свидетелей Пименова, Крюкова, Соловьева и других, вы проводили активную антисоветскую деятельность. Признаете ли вы наконец себя виновным?\n– Нет, виновным себя в антисоветской деятельности я не признаю. Не отрицаю, что во время похорон девушки Андреевой из села Есипово я обратился к присутствующим колхозникам с утешительной речью, что она, умершая, умела и работать, умела и молиться Богу, причастилась и вкусила Святых Таин. Это для нее дороже всего. В разговоре с колхозником Пименовым я также никакой антисоветской агитации не вел. Я не отрицаю, что осенью 1936 года я у него в доме хоронил квартиранта по имени Павел, а так как за похороны я с него ничего не брал, то в связи с наложением на меня налога, который я считал неправильным, я обратился к Пименову с просьбой о выдаче мне справки о бесплатных похоронах квартиранта, никаких других разговоров я с ним не вел.\n26 ноября 1937 года следствие было закончено. 2 декабря тройка НКВД приговорила отца Сергия к расстрелу. Священник Сергий Аманов был расстрелян 10 декабря 1937 года и погребен в безвестной общей могиле.\n \nИгумен Дамаскин (Орловский)\n \n \n«Жития новомучеников и исповедников Российских ХХ века \nМосковской епархии. Дополнительный том 2» \nТверь, 2005 год, стр. 208-213.\n \n \n \n\n","original_url":"http:\/\/www.fond.ru\/index.php?person_id=1375"}
{"person_id":340,"full_name":{"name":"Виктор","surname":"Киранов"},"source":{"publication":"«Жития новомучеников и исповедников Российских ХХ века. Март».\nТверь. 2006. С. 186-195","author":"Игумен Дамаскин (Орловский)"},"relig_status":"Священномученик","occupation":"протоиерей","birth_place":"Мануиловка","birth_date":{"day":8,"month":3,"year":1881},"death_date":{"day":30,"month":3,"year":1942},"original_text":"\n\n\nСвященномученик Виктор (Киранов) протоиерей17 (30) марта\n \nСвященномученик\nВиктор Киранов\n \nСвященномученик Виктор родился 8 марта 1881 года в селе Мануиловка Бердянского уезда Таврической губернии в семье священника Михаила Киранова; его предки были болгарами, спасаясь от турок, они приехали в Россию в 1830 году. Родоначальник семьи Кирановых, священник Протасий, скончавшийся в 1773 году в Турции и много претерпевший от гонителей-турок, завещал своим сыновьям, чтобы они, несмотря на тяжелое положение православных в Болгарии, не уклонялись от священства, если будут призываемы к рукоположению. Виктор Михайлович окончил Таврическую Духовную семинарию и в 1903 году, избрав светскую карьеру, поступил в Юрьевский университет, однако через год все же оставил университет и по назначению епископа Таврического Николая (Зиорова) стал служить псаломщиком в Свято-Троицком храме в селе Новопрокофьевка Бердянского уезда. Виктор Михайлович женился на девице Антонине, выпускнице Симферопольского женского духовного училища, дочери священника Петра Троицкого.\n30 октября 1905 года епископ Таврический Алексий (Молчанов) рукоположил Виктора Михайловича во священника к Покровской церкви села Большая Благовещенка Днепровского уезда. В 1906 году отец Виктор был назначен законоучителем в Нововасильевскую земскую школу. В начале двадцатых годов он был возведен в сан протоиерея и назначен настоятелем Вознесенского собора в Бердянске, а после его закрытия в 1928 году – настоятелем Покровской церкви и благочинным Бердянского округа. Покровская церковь в те годы была единственной в городе, и протоиерей Виктор дал в ней приют всем тем священникам, которые остались без приходов, но хотели служить Господу. Он завел кассу для поддержки малоимущего духовенства, откуда регулярно выдавались небольшие суммы денег, что спасало от голода семьи преследуемого духовенства.\nНесколько раз в Бердянск приезжал архиепископ Днепропетровский Георгий (Делиев), к которому и отец Виктор ездил с докладами по делам благочиния. В 1936 году архиепископ Георгий был арестован и по малодушию оговорил собратьев-епископов и подчиненное ему духовенство, показав о протоиерее Викторе и других священниках Бердянска, что все они были им завербованы во время «архиерейских поездок для шпионской и диверсионной работы».\nВ 1936 году над Покровским храмом нависла угроза закрытия – власти собирались его разрушить, чтобы из кирпича сложить здание школы. Священники, здесь служившие, – протоиереи Виктор Киранов и Михаил Богословский и священник Александр Ильенков, – решили по возможности воспротивиться этому. Обойдя дома верующих, они пригласили их на приходское собрание. Собрание состоялось после Божественной литургии 8 января 1937 года, и пришло на него едва ли не четыре тысячи человек. С протестами против закрытия выступили многие прихожане храма, и один из них сказал: «Советская власть забирает нашу последнюю отраду, нам нужно крепко стоять перед этой властью... Если советской власти надо строить школу, то мы соберем деньги на камень и сдадим...» Присутствующие единодушно поддержали оратора и стали выкрикивать: «Не дадим закрыть церковь!» А выступающий продолжил: «Где тот кирпич из уже разрушенных церквей? Почему из него не построена ни одна школа?.. Миряне, наши сердца уже двадцать лет обливаются кровью...» Зайдя после речи в алтарь, оратор подошел к отцу Виктору, и тот сердечно поблагодарил его за пламенную речь в защиту церкви.\nВыступления верующих в защиту храма не помогли – он вскоре после собрания был закрыт, а некоторое время спустя, летом 1937 года, священники Покровской церкви были арестованы и заключены в тюрьму в Бердянске.\nОтцу Виктору предъявили показания лжесвидетелей, в которых говорилось, будто он поручил им в день выборов отравить колодцы и выдал даже для этого яд. Один из лжесвидетелей показал, что священник приходил к нему на квартиру и брал у него и давал сам шпионские сообщения, предназначенные для епископа Георгия (Делиева). Ознакомив отца Виктора со лжесвидетельствами, начальник Бердянского НКВД потребовал, чтобы священник их подтвердил, но отец Виктор отказался. Последовала площадная ругань, и затем следователи беспощадно избили священника: били по лицу, по животу, по чему попало. Но поскольку это не подействовало, его стали допрашивать круглосуточно: следователи сменялись, а подследственный беспрестанно, в течение тринадцати суток допрашивался. Перерыв в допросах был сделан всего один раз на шесть часов.\nЧерез месяц отец Виктор подписал против себя лжесвидетельства, и дело было отправлено на подпись прокурору. Тот, однако, нашел неудовлетворительным то, как велось дело, и неубедительными показания обвиняемого, и материалы следствия были отправлены в вышестоящую инстанцию – в Москву, откуда пришел ответ, чтобы во всем разбирались на месте.\nСнова начались допросы, во время которых были представлены лжесвидетельства, обвиняющие отца Виктора в антисоветской агитации. К очной ставке был привлечен отрекшийся от сана священник, служивший ранее вместе с отцом Виктором в Покровской церкви. Он заявил, что протоиерей Виктор говорил ему, что колхозное строительство вредно и коллективное хозяйство гибельно для крестьян, что отец Виктор назвал его «балдой» и «подхалимом» за то, что он отказался служить священником и перешел на советскую работу. Лжесвидетель показал также, что отец Виктор являлся руководителем всей приходской жизни, инициатором и руководителем собрания, устроенного после праздника Рождества в защиту храма. В заключение снявший с себя сан лжесвидетель дерзко и нагло сказал: «Пора, Виктор Михайлович, бросить заниматься этим и перейти на честный труд». В ответ отец Виктор назвал его «балдой», за что тут же получил десять суток карцера.\nСобравшись с силами и увидев, какая беспощадно-жестокая и коварная машина работает на уничтожение его личности и всех плодов веры, которые были собраны им за предыдущую жизнь, отец Виктор занял твердую позицию, отказавшись от своей подписи под протоколами допросов с выдвинутыми против него обвинениями, и решительно отверг все, в чем его продолжали обвинять. Опасаясь обмана и подлога со стороны следователя, он 7 марта 1939 года письменно отказался от первоначальных показаний, выбитых у него следователем. А затем в письменном виде заявил, что не признает себя виновным: «Я даю правдивые показания, в антисоветской деятельности я себя виновным не признаю. Никогда антисоветской работы я не вел».\nСледствие было закончено, в ожидании приговора все обвиняемые были отправлены в тюрьму в город Запорожье.\nПротоиерей Виктор писал из заключения близким: «Путь ко спасению проходит нормально, по указанию апостола Иакова – сперва страдания, затем терпение, а перенося их, приучаешься к смирению, которое, надеюсь, породит в будущем любовь и приведет ко спасению... Страдаю я, как вам известно, совершенно невинно юридически и фактически, так как перед государством и перед властью ни в чем не повинен, – весь город это может подтвердить... Перед Богом же виноват за многие и многие грехи, за что и несу это ужасное наказание как заслуженное. Карцер – отсюда только и просить Бога, чтобы простил меня, а я Его лишь благодарю за милость исправления этим путем. Всех вас прошу: да будет мир между вами во спасение ваше, а мне в утешение».\n29 октября 1939 года тройка НКВД приговорила протоиерея Виктора к восьми годам заключения в исправительно-трудовой лагерь, и он был отправлен в Новосибирскую область, откуда писал супруге: «Пишу наскоро... Прибыл к месту своего назначения. Ехал через Харьков, Сызрань, Новосибирск, Томск и Асино в ста верстах от Томска. Жив и здоров – работаю. Писать буду иметь возможность один раз в месяц... Чувствуется, что видеться больше не придется, а там что Бог даст...»\nОбосновавшись в лагере, отец Виктор писал жене: «Мой адрес – с. Асино, Новосибирская область... Возле Асино лагерь трудоисправительный, где меня и воспитывают в этом направлении. Название лагеря показывает его назначение. Трудно, противно и обидно, но ничего не поделаешь. Принимали доброе, примем безропотно и плохое, заканчивать жизнь где-нибудь да нужно; слава Богу, что дал возможность искупить этим путем бесчисленные грехи пред Ним, тобою и семьей. Знаю конечно, что живется вам без меня трудновато, но помогать уже больше ничем не могу, так как нищий есмь... Одежи и белья пока не нужно – обстановка такова, что все это пустая трата. Старые летние туфли, ботинки и две цветных рубахи и брюки из какого-либо дрянного материала пришли к лету... о хорошем, и тем более белом и говорить нечего – не нужно безусловно, смешно и глупо. Живу среди оборванцев, несчастных стариков, и сам уже таков...»\n«...Сперва ходил на лесозаготовки, пилить дрова, потом в овощехранилище перебирать гниль... а теперь дневальным в 8-м бараке, где проживают служащие, управленцы. Хожу в казенной одежде и в лаптях. Дежурю с 1 часа ночи до 7 утра, а днем уборка барака, доставка воды и дров... Словом, настоящий кухонный мужик...»\n«...Мелитопольский кум тысячу раз прав, что я несу кару за грехи свои, и я бесконечно рад, что Бог хоть этим путем направил меня, величайшего грешника, на путь исправления и покаяния, но вообще, говоря объективно, он сказал старческую ерунду, или попросту глупость. Все наши праведники, достойнейшие пастыри несут наказание конечно за свои грехи, но наипаче же за людское невежество и благополучие сидящих на местах и мнящих о своих заслугах, которых никогда не было. Бог дождит на праведных и на злых, и солнышко греет тех и других, в горниле же правды Божией обнаружится, где золото и серебро и где полова и солома. Сам составитель литургии, сокращать которую так боятся, закончил жизнь не в мелитопольском храме, а в ссылке, хотя ничего не сокращал, а наоборот, созидал и составлял, чем мы и до сего времени пользуемся. Слава Богу за все!»\n28 апреля 1940 года отец Виктор писал своим близким: «Я жив и здоров, первое по великой милости Иисуса Христа, а второе по той же милости, возгреваемой – это я, безусловно, чувствую – ходатайством нашего заступника святителя Николая и молитвами – да, молитвами вашими, мои добрые, хорошие друзья. Жизнь моя протекает обычно, как жизнь всякого заключенного, – жизнь серенькая, жалкая, убогая, полная скорби, – скорбь моя о вас, милые мои, не покидает меня ни на минутку, и одиночество, ведь я здесь совершенно одинок... Всякие рассуждения по этому вопросу хотя бы и умных людей разбиваются как рыба об лед – лишь наше духовное общение, наша вера успокаивают эту глубокую, но пока еще не смертельную рану, а день сегодняшний идет со всеми его событиями, примиряет все обиды, наносимые людьми людям, – простим вся Его Воскресением... Вот это прощение и сознание полной невиновности пред обществом, Родиной и правительством дают надежду в успокоении, в ожидании все же хорошего, справедливого конца – нашего вожделенного свидания при домашней семейной обстановке – буди, Господи, буди. Как хочется написать вам, все мои дорогие друзья, еще много-много теплых, хороших слов, но не знаешь, как их и изложить, – ну, словом, в настоящие святые минутки плачу, люблю, целую всех вас, понимаю вас – как, надеюсь, и вы меня понимаете – всеми фибрами своего существа. Вонми, Господи, нашему взаимному молению и в этот час, как жертву хваления, прими наше краткое взаимное восклицание: Христос воскресе! и ответное: Воистину воскресе!..»\nВесной 1940 года протоиерей Виктор был отправлен в Темниковские лагеря, откуда написал родным: «Я по великой и незаслуженной милости Божией жив и здоров... За посылки очень и очень благодарен, но зачем же сразу две? Это пересол, убыточный и для вас, и для меня – хранить легко мало, а избыток не знаешь, куда и положить. Мало вы представляете условия моей жизни. В будущем придерживайтесь планомерности. Местность, в которой живу, называется Темники – это бывшая Саровская пустынь. О себе писать ничего не могу, скажу только, что вы все далеки от малейшего представления и бытовых условий, и внешнего моего вида, в каком я нахожусь. Сейчас взял у врача однодневный отдых – шалит сердце, и вот имею возможность черкнуть вам несколько слов, в остальные дни ночью ухожу на работу, ночью и прихожу, времени и условий для писания нет...»\n1 ноября 1940 года отец Виктор написал: «Я жив и здоров, все это по великой милости Божией и за усердие ваших молитв, по заступничеству нашего покровителя святителя Николая. Егда был еси юн, поясался еси сам и ходил еси, аможе хотел еси: егда же состареешися... ин тя пояшет и ведет, аможе не хощеши. Если перефразировать это на слово “писать”, то для вас должно быть понятным, – что могу я о себе писать? Да ничего, мы должны, находясь в таком положении, больше чувствовать, чем понимать... Все три посылки получил. Великое... спасибо с глубоким поклоном несчастного зека шлю вам, недостойный этого внимания. Примечание дружеское: посылать нужно то, что можно носить и хранить в кармане, – это сухари, колбаса, конфеты. Отломил, взял в карман и пошел на работу, и есть это непоказно...»\n22 января 1941 года он писал родным: «Я после долгого времени работы на лесоповале, где страшно устал и оборвался, месяц был дневальным и хорошо отдохнул – сейчас зачислен в разряд актированных инвалидов 2-го разряда и нахожусь в 11-м лагпункте на работе в закрытом помещении – вязание сетей...»\nПоздравляя супругу с тезоименитством, отец Виктор писал ей в феврале 1941 года: «Будь здорова, быть может, Господь сжалится над Своим плохим служителем и сподобит еще хоть немного пожить нам вместе в мире, радости и взаимной любви. Как бы хотелось еще пожить вместе и, подводя итоги прошлой жизни, запереться от всего мира в свою хатку и безвыходно просидеть в ней до конца своей жизни, слушая твои милые, всегда добрые и ласковые разговоры молча, наслаждаться ими, попутно уплетая всегда опрятно и вкусно приготовленные и любимые мною кушанья. Это с одной стороны, а с другой – провести нам вместе остатки жизни в благочестии и молитвенном настроении, благодаря Бога за Его великие милости и награды во всю прошлую жизнь, и, наслаждаясь здоровьем и любовью своих милых, всегда нами любимых деток и внуков, быть их молитвенниками пред образом нашего покровителя, святителя Николая. Вот мои пожелания тебе, моя дорогая именинница, – да будет во всем воля Божия: пробави, Господи, милости Свои и впредь над недостойными, но любящими Тебя супругами.\nМоим друзьям шлю свой привет и поздравление со вступлением в великие дни предстоящей Триоди. В воскресенье, 10 марта, помолимся вместе здоровою духовною молитвою, и я заочно разрешу вас от всех болезней, накопленных за период времени отсутствия врачебницы, а вы помолитесь за узника, всегда духовно пребывающего с вами...»\nЧерез месяц отец Виктор написал родным: «...О свидании не хлопочу, потому что оно невозможно и не нужно. Сохраните все представление о мне по прежнему моему образу и сохраните его в своей памяти, а теперешний свой вид я унесу в могилу, о котором вы не будете иметь представления, – и хорошо. Свидание – это лишние слезы и ужас, да и ненужная затрата необходимых для вас средств. Если Господь не сподобит повидаться, да будет воля Его, а сподобит – поговорим и поплачем слезами радости. Актированных инвалидов за зону лагеря не выводят, и работают посильно лишь в зоне лагеря. Я ходил на работы за 3-7 километров. Что касается досрочного освобождения для таковых, то это фантазия, покоящаяся на огнепальном желании свободы, и только. На первую свою жалобу от марта 40-го года получил ответ, что оснований для пересмотра дела нет, а потому – без последствий... Ну, что Бог даст, чувство полной невиновности пред властью и государством позволит примириться со всеми страданиями...»\nС началом Великой Отечественной войны положение заключенных резко ухудшилось; многие стали умирать, оставшись без поддержки родных, которые сами в это время оказались в бедственном положении. Протоиерей Виктор Киранов скончался в Темниковском лагере 30 марта 1942 года и был погребен в безвестной могиле.\n \n \n\nИгумен Дамаскин (Орловский)\n«Жития новомучеников и исповедников Российских ХХ века. Март».\nТверь. 2006. С. 186-195\n\n \n \n\n \n\n \n\n","original_url":"http:\/\/www.fond.ru\/index.php?person_id=340"}
{"person_id":710,"full_name":{"name":"Михаил","surname":"Люберцев"},"source":{"publication":"«Мученики, исповедники и подвижники благочестия\nРусской Православной Церкви ХХ столетия.\nЖизнеописания и материалы к ним. Книга 3»\nТверь. 2001. С. 143-146","author":"Игумен Дамаскин (Орловский)"},"relig_status":"Священномученик","occupation":"священник","birth_place":"Осташков","birth_date":{"day":4,"month":9,"year":null},"death_date":{"day":4,"month":9,"year":1937},"original_text":"\n\n\nСвященномученик Михаил (Люберцев) священникАвгуста 22 (4 сентября)\n \nСвященномученик\nМихаил Люберцев\n \nСвященномученик Михаил родился 21 октября 1883 года в городе Осташкове Тверской губернии в семье портного Сергея Люберцева. Окончил духовное училище и с 1901 по 1907 год был учителем в 4-й приходской школе в родном городе. Решив избрать для себя новое, сугубо церковное поприще, он в 1907 году поступил псаломщиком в Преображенскую церковь города Осташкова.\nВ 1912 году Михаил Сергеевич был рукоположен в сан диакона к одному из храмов города Старицы и прослужил здесь до 1918 года, когда, вернувшись в Осташков, стал служить в Знаменском монастыре. Нападение большевиков на Нилову пустынь, изъятие церковных ценностей из храмов Осташкова – все эти события прошли перед глазами диакона Михаила.\nВ конце двадцатых годов усилилось гонение на Православную Церковь. В 1931 году ОГПУ арестовало епископа Великолукского Тихона (Рождественского) и вместе с ним духовенство Великих Лук, Торопца, Осташкова, насельников Ниловой пустыни, многих монахинь и послушниц, всего – сто девяносто одного человека: девяносто девять священноиноков и монахов, двадцать пять – белых священников и диаконов и шестьдесят семь мирян – из крестьян, офицеров царской армии и дворян. Диакона Михаила арестовали 19 марта 1931 года. Арестованных обвиняли в том, что они, вопреки распоряжению советских властей, закрывших все монастыри в области, организовали нелегальный монастырь, который высоким идеалом христианского подвига стал привлекать многих мирян, а также и в том, что они организовали кружки для школьников для изучения Закона Божьего, создали сестричества, которые действовали в Великих Луках, Торопце и Осташкове, причем среди членов сестричеств широко распространялась богословская литература. Желая придать обвинениям политический характер, власти заявили, что их религиозная деятельность привела к развалу колхозов в этих районах.\nДиакон Михаил был приговорен к трем годам ссылки в Северный край. Тюремное заключение и ссылка не сломили его дух, но, наоборот, укрепили в нем веру и упование на Бога. Несмотря на то что у него была большая семья – три сына и две дочери (младшим детям было шесть и десять лет), он был полон решимости служить Богу и святой Православной Церкви до конца.\nИз ссылки он вернулся в 1934 году и был рукоположен в сан священника к Успенской церкви в селе Щучье Осташковского района, где прослужил до мученической кончины в 1937 году.\nВласти пытались ограничить благодатное влияние Церкви только стенами храма, всячески препятствуя священнику ходить с молебнами по дальним деревням своего прихода, исповедовать и причащать тех, кто не мог дойти до храма. Однако всех таковых о. Михаил посещал, ходил по деревням с крестными ходами и служил молебны в домах и в полях. Для своих духовных детей, прихожан, он был подлинным пастырем и душепопечительным отцом. Но не желая, чтобы его упрекали в том, что он действует, не попытавшись получить разрешение исполкома, он шел испрашивать его к властям, но почти всегда получал отказ.\n18 июня верующие одной из деревень прихода обратились в сельсовет за разрешением на службу молебнов в их домах и на крестный ход с иконами в день Троицы. Сельсовет в этой просьбе верующих отказал.\n22 июля о. Михаила вызвали в правление колхоза, где председатель сельсовета в присутствии колхозников стал предлагать священнику подписаться на заем.\n– Подписаться на заем – это дело хорошее, – ответил священник. – Но вот мне хлеба в кооперативном магазине не продают. Мне не разрешают ходить по приходу с молебнами. А кроме того, я и так плачу очень большой налог... Но все же, я подпишусь на заем, но с условием, если вы мне разрешите совершать богослужения в домах. Например, 2 августа, на Ильин день, в деревне Лукьяново.\n– Хорошо, – ответил председатель сельсовета, – пусть желающие граждане подадут по этому вопросу заявление, и сельсовет его разберет.\nВ тот же вечер о. Михаил позвал к себе одного из членов двадцатки и сказал:\n– Представляется возможность снова просить о разрешении служить молебны по домам и о крестном ходе с иконами на Ильин день, но для этого нужно, чтобы верующие подали заявление в сельсовет. Когда придешь в сельсовет, то скажи, что если они разрешат служение молебнов, то все верующие подпишутся на заем.\nЗаявление было написано, подписи собраны, и все документы поданы уже на следующий день, 23 июля, но сельсовет в просьбе отказал. На другой день сотрудник НКВД подал документы на арест священника. В них он писал: \"Являясь контрреволюционно настроенным, Люберцев проводил контрреволюционную агитацию, направленную к срыву проводимых мероприятий в деревне, выступил с агитацией против займа, агитируя колхозников подписываться на заем в том случае, если сельский совет разрешит совершать богослужение с хождением с иконами по деревням\".\nВ тот же день о. Михаил был арестован и заключен в Осташковскую тюрьму. В качестве вещественных доказательств его преступлений из его дома были взяты книга сочинений святого праведного Иоанна Кронштадтского и двенадцать иллюстраций к Священной истории.\nНа следующий день следователь НКВД допросил священника. Отец Михаил держался в тюрьме и на допросах бесстрашно и свободно и на вопрос следователя, признает ли он себя виновным, ответил, что никоим образом не признает.\nБыл вызван один из членов сельсовета, который показал: \"Мне известно, что Люберцев говорил, что нужно добиться, чтобы сельсовет считался с верующими и что верующие должны крепко стоять за веру\".\nВызвали члена двадцатки, ходившего в сельсовет, который сказал: \"Люберцев часто призывал верующих стоять за веру и защищать Церковь от нападок. По вопросу о положении с колхозами Люберцев часто говорил, что не надо терпеть и ждать, когда изменится жизнь к лучшему. Помню, что однажды, примерно в конце апреля месяца сего года, перед Пасхой, на заданный Люберцеву вопрос о войне, он пояснил, что война скоро будет, а кто победит – фашисты или СССР, сказать трудно, так как победа СССР над фашистами будет зависеть от того, как крестьяне пойдут защищать СССР\".\nОдин из колхозников, вызванный на допрос, показал: \"В июне месяце стояла большая засуха и не было дождя. Люберцев стал вести работу среди верующих, обрабатывая их в контрреволюционном духе и заявляя, что нужно добиться разрешения организовать по деревням ход с иконами и просить Господа Бога, как говорил Люберцев, о послании дождя. Сельсовет, конечно, в этом отказал. Тогда Люберцев повел контрреволюционную агитацию, говоря, что нет дождя потому, что прогневали Господа Бога, и что за попирание веры будут все жестоко наказаны. Помню, что мне пришлось случайно услышать, как Люберцев среди верующих по вопросу о войне говорил, что скоро будет война и что в этой войне много погибнет людей\".\n31 августа Тройка НКВД приговорила о. Михаила к расстрелу. Священник Михаил Люберцев был расстрелян 4 сентября 1937 года.\n \n \nИгумен Дамаскин (Орловский)\n«Мученики, исповедники и подвижники благочестия\nРусской Православной Церкви ХХ столетия.\nЖизнеописания и материалы к ним. Книга 3»\nТверь. 2001. С. 143-146\n \n \n \n\n \n\n \n\n","original_url":"http:\/\/www.fond.ru\/index.php?person_id=710"}
{"person_id":205,"full_name":{"name":"Василий","surname":"Надеждин"},"source":{"publication":"«Жития новомучеников и исповедников Российских ХХ века. Февраль».\nТверь. 2005. С. 154-161","author":"Игумен Дамаскин (Орловский)"},"relig_status":"Священномученик","occupation":"священник","birth_place":"Москва","birth_date":{"day":12,"month":1,"year":1895},"death_date":{"day":24,"month":12,"year":1929},"original_text":"\n\n\nСвященномученик Василий (Надеждин) священник6 (19) февраля\n \nСвященномученик\nВасилий Надеждин\n \nСвященномученик Василий родился 12 января 1895 года в Москве в семье Федора Алексеевича и Софьи Павловны Надеждиных. Федор Алексеевич служил чиновником Дворцового управления в звании коллежского асессора и доводился родственником архиепископу Анастасию (Грибановскому).\nВ 1910 году Василий окончил Заиконоспасское духовное училище, в 1916 году – Московскую Духовную семинарию. Учась в семинарии, он на каникулы ездил в Холмскую губернию, где владыка Анастасий был в то время епархиальным архиереем.\nВасилий писал владыке Анастасию: «Я хочу окончить Духовную академию и быть священником – это решение подсказывает мне моя душа, которую привлекает пастырская деятельность. Я знаю (и это бесспорно), что чем солиднее, обширнее и значительнее будет мое образование, тем ценнее для дела Церкви и интереснее для меня самого будет моя деятельность как пастыря».\nЛетом 1916 года Василий уехал готовиться к экзаменам в Кишинев, куда был переведен владыка Анастасий. Осенью он поступил в Московскую Духовную академию, занятия в которой из-за войны стали идти с перебоями; в конце ноября он был приглашен графом Александром Медемом в его имение в Хвалынском уезде Саратовской губернии преподавать Закон Божий его детям Федору и Софии.\nВ конце февраля 1917 года возобновились занятия в академии, и Василий выехал в Москву, жители которой в то время ликовали по поводу отречения императора Николая II от престола, ликовали и студенты академии. По окончании учебного года Василий снова уехал в имение графа. Последствия разрушительной революции быстро докатились до губернских городов, и начались грабежи и убийства. Осенью 1917 года он вернулся в Москву для продолжения учебы.\nВ начале 1919 года Духовная академия была закрыта пришедшими к власти безбожниками. В апреле 1919 года Василий Федорович обвенчался с Еленой Сергеевной Борисоглебской и уехал в село Никольский Поим Чембарского уезда Пензенской губернии, где служил знакомый ему священник, и работал здесь до 1921 года учителем в школе. В марте 1921 года он с семьей переехал ближе к Москве, устроившись счетоводом в построечном управлении узкоколейки в Орехово-Зуеве.\n24 июня 1921 года Василий Федорович был рукоположен во диакона, а 26 июня – во священника к Никольскому храму у Соломенной Сторожки в Москве, построенному в начале ХХ столетия. До революции это был храм 675-й пешей тульской дружины.\nДочь священномученика Владимира Амбарцумова, расстрелянного на Бутовском полигоне в 1937 году, писала о храме и об отце Василии: «Возле церкви некогда существовала сторожевая будка с соломенной крышей, известная в народе как “соломенная сторожка”. Ко времени строительства храма ее уже не было, но народная память сохранила за этим местом старое наименование...\nВ храм ходили разные люди, но... состав приходской общины прежде всего определялся близостью Петровско-Разумовской академии...\nКогда после революции было запрещено преподавание в школах Закона Божия и в Петровско-Разумовской академии закрыли храм, группа ее профессоров и преподавателей обратилась к настоятелю храма Святителя Николая» священнику Василию Надеждину «с просьбой заняться религиозно-нравственным воспитанием их детей... Отец Василий живо откликнулся на просьбу профессоров академии. Он создал... молодежный хор, поющий на правом клиросе храма... учил девушек и юношей не только церковному пению, но и церковной службе, разбирал основные вопросы вероучения, ходил с ними и на концерты классической музыки, читал и обсуждал литературные произведения. Для маленьких детей в доме отца Василия обязательно проводились запрещенные тогда рождественские елки...\nОтец Василий был прекрасным проповедником. Его любимое время для проповедей было в субботу на утрене после шестопсалмия... Он не отшлифовывал своих проповедей, но говорил живо и убежденно, часто выступая против безверия».\nВ октябре 1927 года отец Василий получил документ об окончании Московской Духовной академии по первому разряду со степенью кандидата богословия, в котором поставили свои подписи еще не арестованные тогда профессора Духовной академии, включая проректора протоиерея Владимира Страхова.\nВ 1928 году у отца Василия обнаружилось заболевание туберкулезом, и он был вынужден уехать в Башкирию для лечения кумысом. Во время его отсутствия в Никольском храме служил по его просьбе священник Владимир Амбарцумов.\nВернувшись в Москву, отец Василий в связи со все усиливающимися гонениями стал реже говорить проповеди; милиция запретила ему появляться в доме, где жила его семья, и священник снял угол – чулан в квартире, куда к нему приезжала супруга, стараясь, чтобы и эти визиты остались незамеченными для властей.\nОтец Василий был арестован 28 октября 1928 года и заключен в Бутырскую тюрьму в Москве. Его обвинили в том, что он «организовал кружок христианской молодежи, работой которого и руководил, воспитывая молодежь в тенденциозно-антисоветском направлении».\n1 ноября следователь допросил священника. Он назвал, что именно интересует следствие, и отец Василий сказал: «О близкой ко мне молодежи могу сказать следующее: пришла ко мне она сама. Все лица, впоследствии бывавшие у меня, были связаны между собой еще школой, где они вместе учились. Вероятно, поэтому они также всей группой и перешли ко мне. У меня в церкви эта молодежь пела в хоре...\nСама молодежь была неактивна в изучении хотя бы церковной истории, поэтому я сам читал им иногда на темы по истории Церкви выдержки из церковных писателей Болотова и Лебедева, читал им некоторые подлинники сочинений церковных писателей (Василия Великого, Григория Богослова и других).\nДелал доклад о впечатлениях от моей поездки в Саровскую пустынь, о тех сказаниях, которые связаны с Дивеевым монастырем и Серафимом Саровским...\nБыли у меня беседы, посвященные юбилеям Первого Вселенского Собора, Григория Богослова и Василия Великого. Собственно, проповедь в церкви была по этим вопросам, а дома молодежи я читал только некоторые документы той эпохи.\nСпециальных вопросов по поводу существующего социального порядка и по поводу отдельных моментов взаимоотношения Церкви и государства, равно и чисто политических вопросов, мы никогда не обсуждали. Последние, то есть политические вопросы, иногда только, и то вскользь, в обывательском разрезе, трактовались у нас; говорили, например, что жестока политика власти по отношению к детям лишенцев и к лишенцам вообще... В вопросах об арестах церковников я придерживаюсь той точки зрения, что трудно провести грань между церковным и антисоветским и что поэтому со стороны власти возможны перегибы...\nМолодежь у меня принимает участие в церковных делах с 1921 года. Всего у меня не больше десяти человек...\nКогда у нас затрагивался вопрос об исповедничестве, то есть о возможности примирения верующих с окружающими условиями, то здесь я проводил такую точку зрения: есть пределы (для каждого различные), в которых каждый христианин может примиряться с окружающей его нехристианской действительностью; при нарушении этих пределов он должен уже примириться с возможностью и неприятных для него лично изменений условий его жизни, иначе он не есть христианин. Христианином надо быть не только по имени...»\n20 ноября 1929 года Особое Совещание при Коллегии ОГПУ приговорило священника к трем годам заключения в концлагере, и он был отправлен на Соловки. Но когда он прибыл в пересыльный лагерный пункт в город Кемь, морская навигация уже закончилась, и отец Василий был оставлен в Кеми. Это было время, когда на всем Соловецком архипелаге, превращенном в концлагеря, свирепствовала эпидемия сыпного тифа. Отец Василий заболел тифом и был помещен в лагерную больницу. В больнице ему сделали укол и внесли инфекцию, что привело к гангрене. Во время болезни священника к нему приехала супруга и, поселившись в Кеми неподалеку от лагеря, каждый день носила ему передачи.\n«Хожу утром и вечером вдоль деревянного забора с проволокой наверху и дохожу до лазарета... Вижу верхнюю часть замерзшего окна и посылаю привет и молюсь. В три часа делаю передачу... получаю записку, написанную слабым почерком. Вот и все! Ночь проходит в тоске и мучительных снах. Каждый раз, как отворяется дверь нашей квартиры, я смотрю, не пришли ли сказать роковую весть. Его остригли, изменился он сильно и исхудал, говорят, перевязки мучительны и изнуряют его...»\nНезадолго перед кончиной отец Василий сподобился принятия Святых Христовых Таин. Последние его слова были: «Господи, спаси благочестивыя и услыши ны». Священник Василий Надеждин скончался в лагерной больнице 19 февраля 1930 года. Начальник лагеря разрешил жене священника помолиться ночью рядом с телом почившего мужа и похоронить его на кладбище в Кеми.\n24 декабря 1929 года, еще до болезни, отец Василий отправил жене последнее письмо, которое явилось своеобразным прощанием с близкими: «Сегодня, в день Ангела моего старшего сынка... мне пришла мысль грустная, но, кажется мне, правильная, что я должен написать прощальное письмо на случай моей смерти... Ибо если я заболею тифом, то писать уже не смогу, никого из близких не увижу и не услышу, не смогу ничего передать им, кроме этого письма, если оно будет написано заранее и... если Господь устроит так, что оно дойдет до моих близких... Это письмо должно заменить меня, прощание со мною, участие в моих похоронах, которые произойдут здесь без участия моих близких, без их молитвы и слез... Первое слово к тебе, моя дорогая, любимая, единственная... Прежде всего, благословляю тебя за твою любовь, за твою дружбу, за твою преданность мне... Да будет воля Божия! Мы дождемся радостного свидания в светлом Царстве любви и радости, где уже никто не сможет разлучить нас, – и ты расскажешь мне о том, как прожила ты жизнь без меня, как ты сумела по‐христиански воспитать наших детей, как ты сумела внушить им ужас и отвращение к мрачному безбожному мировоззрению и запечатлеть в их сердцах светлый образ Христа...»\n \n \n\nИгумен Дамаскин (Орловский)\n«Жития новомучеников и исповедников Российских ХХ века. Февраль».\nТверь. 2005. С. 154-161\n\n \n \n\n\n \n \n\n\n \n\n","original_url":"http:\/\/www.fond.ru\/index.php?person_id=205"}
{"person_id":985,"full_name":{"name":"Николай","surname":"Верещагин"},"source":{"publication":"«Мученики, исповедники и подвижники благочестия\nРусской Православной Церкви ХХ столетия.\nЖизнеописания и материалы к ним. Книга 3»\nТверь. 2001. С. 254-255","author":"Игумен Дамаскин (Орловский)"},"relig_status":"Священномученик","occupation":"священник","birth_place":"Глёбово","birth_date":{"day":10,"month":12,"year":1893},"death_date":{"day":17,"month":10,"year":1937},"original_text":"\n\n\nСвященномученик Николай (Верещагин) священникОктября 4 (17)\n \nСвященномученик \nНиколай Верещагин\n \nСвященномученик Николай родился 10 декабря 1893 года в селе Глебово Старицкого уезда Тверской губернии в семье священнослужителя Михаила Верещагина. Образование получил в Тверской Духовной семинарии и был рукоположен в сан священника уже в то время, когда начались послереволюционные гонения. Служил в селе Глебово, где служил и его отец.\nКогда летом 1937 года начались гонения, сотрудник Старицкого НКВД, собирая сведения о подлежащих аресту и уничтожению священнослужителях, допросил одного из крестьян села Глебова, который согласился лжесвидетельствовать против священника и показал: \"...Приблизительно в июле 1937 года колхозники колхоза \"Рабочий путь\" приехали за камнем к церковной ограде. Среди этих колхозников лично при мне Верещагин, ведя контрреволюционную агитацию, заявил: \"Вы зря забираете церковный камень. Знайте, что скоро крах советской власти. Неверующих будут высылать, а их вожаков всех уничтожат\". ...В дополнение этих контрреволюционных фактов надо заявить, что Верещагин бродяжничает по колхозам и также проводит контрреволюционную агитацию, говоря: \"Разве это жизнь в колхозах, это старая барщина, где также верующий мог посещать церковь только с разрешения барина\". Наконец, заслуживает внимания то, что Верещагин в качестве церковного старосты пригласил неизвестную личность – Подгурного Стефана Андреевича – поляка, который прибыл в наше село Глебово в 1930 году и с того времени также проживает в церковной сторожке и враждебно настроен, но хитрый, открыто не выступает\".\nВ тот же день следователь допросил и пришельца. Вероятно, опасаясь за свое положение, проявив крайнее малодушие, Стефан Андреевич согласился лжесвидетельствовать против священника и оклеветал его.\nНесмотря на полученные показания лжесвидетелей, НКВД не сразу арестовал священника. Только 20 сентября о. Николай был арестован и заключен в тюрьму города Ржева. В тот же день следователь допросил его. Священник твердо стоял на своем, отказываясь лжесвидетельствовать, и допрос был недолгим:\n– Следствие располагает данными о том, что вы систематически проводили контрреволюционную агитацию, направленную на срыв мероприятий партии и правительства. Признаете ли себя виновным в этом? – спросил следователь.\n– Нет, виновным себя не признаю, так как контрреволюционную агитацию я не проводил.\n– Почему вы не хотите дать справедливых показаний? Следствие располагает данными о том, что вы в июле 1937 года среди колхозников, которые забирали камень от церковной ограды, вели контрреволюционную агитацию, указывая, что скоро настанет крах советской власти, и тому подобное.\n– Да, действительно, в июле сего года забирали камень, но среди работающих я контрреволюционную агитацию не проводил.\n– Вы упорно не даете справедливых показаний, между тем следствие располагает данными, что вы систематически проводили контрреволюционную агитацию. Вы признаете себя виновным в этом?\n– Нет, виновным себя не признаю и больше показать ничего не могу.\n15 октября Тройка НКВД приговорила о. Николая к расстрелу. Священник Николай Верещагин был расстрелян через день, 17 октября 1937 года.\n \n \nИгумен Дамаскин (Орловский)\n«Мученики, исповедники и подвижники благочестия\nРусской Православной Церкви ХХ столетия.\nЖизнеописания и материалы к ним. Книга 3»\nТверь. 2001. С. 254-255\n \n \n \n\n \n\n \n\n","original_url":"http:\/\/www.fond.ru\/index.php?person_id=985"}
